{
  "feature": "user-profile",
  "requirementDoc": "docs/requirement/user-profile.md",
  "planDoc": "docs/plans/user-profile.md",
  "createdAt": "2026-04-16T10:55:00.000Z",
  "updatedAt": "2026-04-16T10:55:00.000Z",
  "completedAt": null,
  "lastRun": null,
  "tasks": [
    {
      "id": "TASK-01",
      "name": "实现核心服务模块",
      "status": "pending",
      "dependsOn": [],
      "parallelizable": false,
      "output": "",
      "startedAt": null,
      "completedAt": null,
      "durationSeconds": null
    },
    {
      "id": "TASK-02",
      "name": "实现单元测试",
      "status": "pending",
      "dependsOn": ["TASK-01"],
      "parallelizable": false,
      "output": "",
      "startedAt": null,
      "completedAt": null,
      "durationSeconds": null
    },
    {
      "id": "TASK-03",
      "name": "实现集成测试",
      "status": "pending",
      "dependsOn": ["TASK-01"],
      "parallelizable": true,
      "output": "",
      "startedAt": null,
      "completedAt": null,
      "durationSeconds": null
    },
    {
      "id": "TASK-04",
      "name": "全量测试验证",
      "status": "pending",
      "dependsOn": ["TASK-02", "TASK-03"],
      "parallelizable": false,
      "output": "",
      "startedAt": null,
      "completedAt": null,
      "durationSeconds": null
    }
  ]
}
